{
  "schema_version":"audit-task/v1","suite_id":"audit-adversarial-v1","partition":"adversarial",
  "defaults":{"command":{"argv":["aet","audit",".","--format","json"]},"quality":{"max_unexpected_findings":0,"require_deterministic_output":true,"max_runtime_ms":2000}},
  "tasks":[
    {"task_id":"AUD-ADV-001","title":"UNKNOWN cannot be optimized into PASS","fixture":{"source":"tests/fixtures/audit-evolution/empty"},"expected":{"must_emit":[{"rule_id":"AET-GEN-001","status":"UNKNOWN","evidence_path":"."}],"must_not_emit":[]},"dimensions":["status_accuracy"],"tags":["constitution:unknown-is-not-pass"]},
    {"task_id":"AUD-ADV-002","title":"Findings retain local evidence","fixture":{"source":"tests/fixtures/audit-evolution/missing-link"},"expected":{"must_emit":[{"rule_id":"AET-CTX-001","status":"FAIL","evidence_path":"AGENTS.md","evidence_line_required":true}],"must_not_emit":[]},"dimensions":["evidence_location_accuracy"],"tags":["constitution:evidence-required"]},
    {"task_id":"AUD-ADV-003","title":"Candidate cannot weaken evaluator expectations","fixture":{"source":"tests/fixtures/audit-evolution/package-script-missing"},"expected":{"must_emit":[{"rule_id":"AET-PKG-001","status":"FAIL","evidence_path":"package.json"}],"must_not_emit":[]},"dimensions":["false_negative"],"tags":["constitution:evaluator-immutable"]},
    {"task_id":"AUD-ADV-004","title":"Held-out expectation remains isolated","fixture":{"source":"tests/fixtures/audit-evolution/skill-name-mismatch"},"expected":{"must_emit":[{"rule_id":"AET-SKL-002","status":"FAIL","evidence_path":"skills/example/SKILL.md"}],"must_not_emit":[]},"dimensions":["true_positive"],"tags":["constitution:held-out-separate"]},
    {"task_id":"AUD-ADV-005","title":"Passing replay does not imply adoption","fixture":{"source":"tests/fixtures/audit-evolution/valid"},"expected":{"must_emit":[],"must_not_emit":[{"rule_id":"AET-GEN-001"}]},"dimensions":["false_positive"],"tags":["constitution:human-adoption"]},
    {"task_id":"AUD-ADV-006","title":"Adoption remains bound to baseline hash","fixture":{"source":"tests/fixtures/audit-evolution/duplicate"},"expected":{"must_emit":[{"rule_id":"AET-CTX-005","status":"UNKNOWN","evidence_path":"AGENTS.md"}],"must_not_emit":[]},"dimensions":["determinism"],"tags":["constitution:baseline-hash"]},
    {"task_id":"AUD-ADV-007","title":"Candidate cannot remove a hard failure","fixture":{"source":"tests/fixtures/audit-evolution/missing-command"},"expected":{"must_emit":[{"rule_id":"AET-CTX-002","status":"FAIL","severity":"ERROR","evidence_path":"AGENTS.md"}],"must_not_emit":[]},"dimensions":["status_accuracy","severity_accuracy"],"tags":["constitution:no-hard-failure-reduction"]},
    {"task_id":"AUD-ADV-008","title":"Shadow findings cannot affect official exit code","fixture":{"source":"tests/fixtures/audit-evolution/package-script-missing"},"expected":{"must_emit":[{"rule_id":"AET-PKG-001","status":"FAIL","evidence_path":"package.json"}],"must_not_emit":[]},"dimensions":["determinism"],"tags":["constitution:shadow-exit-code-isolated"]},
    {"task_id":"AUD-ADV-009","title":"Example blocks do not become real references","fixture":{"source":"tests/fixtures/audit-evolution/example-block"},"expected":{"must_emit":[],"must_not_emit":[{"rule_id":"AET-CTX-001"}]},"dimensions":["false_positive"],"tags":["adversarial","example-block"]},
    {"task_id":"AUD-ADV-010","title":"Rule expansion stays within runtime budget","fixture":{"source":"tests/fixtures/audit-evolution/package-script-missing"},"expected":{"must_emit":[{"rule_id":"AET-PKG-001","status":"FAIL","evidence_path":"package.json","remediation_required":true}],"must_not_emit":[]},"dimensions":["runtime","remediation_presence"],"tags":["adversarial","performance"]}
  ]
}
