{
  "schema_version":"audit-task/v1","suite_id":"audit-validation-v1","partition":"validation",
  "defaults":{"command":{"argv":["aet","audit",".","--format","json"]},"quality":{"max_unexpected_findings":0,"require_deterministic_output":true,"max_runtime_ms":2000}},
  "tasks":[
    {"task_id":"AUD-VAL-001","title":"General UNKNOWN validation","fixture":{"source":"tests/fixtures/audit-evolution/empty"},"expected":{"must_emit":[{"rule_id":"AET-GEN-001","status":"UNKNOWN","evidence_path":"."}],"must_not_emit":[]},"dimensions":["true_positive","status_accuracy"],"tags":["unknown"]},
    {"task_id":"AUD-VAL-002","title":"Clean repository validation","fixture":{"source":"tests/fixtures/audit-evolution/valid"},"expected":{"must_emit":[],"must_not_emit":[{"rule_id":"AET-GEN-001"},{"rule_id":"AET-CTX-001"}]},"dimensions":["false_positive"],"tags":["negative"]},
    {"task_id":"AUD-VAL-003","title":"Link regression validation","fixture":{"source":"tests/fixtures/audit-evolution/missing-link"},"expected":{"must_emit":[{"rule_id":"AET-CTX-001","status":"FAIL","evidence_path":"AGENTS.md"}],"must_not_emit":[]},"dimensions":["true_positive","false_negative"],"tags":["reference"]},
    {"task_id":"AUD-VAL-004","title":"Command regression validation","fixture":{"source":"tests/fixtures/audit-evolution/missing-command"},"expected":{"must_emit":[{"rule_id":"AET-CTX-002","status":"FAIL","evidence_path":"AGENTS.md"}],"must_not_emit":[]},"dimensions":["evidence_location_accuracy"],"tags":["command"]},
    {"task_id":"AUD-VAL-005","title":"Absolute-path regression validation","fixture":{"source":"tests/fixtures/audit-evolution/missing-absolute"},"expected":{"must_emit":[{"rule_id":"AET-CTX-003","status":"FAIL","severity":"ERROR","evidence_path":"AGENTS.md"}],"must_not_emit":[]},"dimensions":["severity_accuracy"],"tags":["absolute-path"]},
    {"task_id":"AUD-VAL-006","title":"Frontmatter regression validation","fixture":{"source":"tests/fixtures/audit-evolution/skill-missing-frontmatter"},"expected":{"must_emit":[{"rule_id":"AET-SKL-001","status":"FAIL","evidence_path":"skills/example/SKILL.md"}],"must_not_emit":[{"rule_id":"AET-SKL-002"}]},"dimensions":["true_positive","false_positive"],"tags":["skill"]},
    {"task_id":"AUD-VAL-007","title":"Name mismatch regression validation","fixture":{"source":"tests/fixtures/audit-evolution/skill-name-mismatch"},"expected":{"must_emit":[{"rule_id":"AET-SKL-002","status":"FAIL","evidence_path":"skills/example/SKILL.md"}],"must_not_emit":[{"rule_id":"AET-SKL-001"}]},"dimensions":["status_accuracy"],"tags":["skill"]},
    {"task_id":"AUD-VAL-008","title":"Verification regression validation","fixture":{"source":"tests/fixtures/audit-evolution/skill-no-verification"},"expected":{"must_emit":[{"rule_id":"AET-SKL-004","status":"UNKNOWN","severity":"WARN","evidence_path":"skills/example/SKILL.md"}],"must_not_emit":[]},"dimensions":["status_accuracy","severity_accuracy"],"tags":["skill","unknown"]},
    {"task_id":"AUD-VAL-009","title":"Duplicate regression validation","fixture":{"source":"tests/fixtures/audit-evolution/duplicate"},"expected":{"must_emit":[{"rule_id":"AET-CTX-005","status":"UNKNOWN","evidence_path":"AGENTS.md"}],"must_not_emit":[]},"dimensions":["determinism"],"tags":["duplicate"]},
    {"task_id":"AUD-VAL-010","title":"Package script newly detected","fixture":{"source":"tests/fixtures/audit-evolution/package-script-missing"},"expected":{"must_emit":[{"rule_id":"AET-PKG-001","status":"FAIL","evidence_path":"package.json"}],"must_not_emit":[]},"dimensions":["false_negative","true_positive"],"tags":["target-improvement","package-json"]},
    {"task_id":"AUD-VAL-011","title":"Link remediation validation","fixture":{"source":"tests/fixtures/audit-evolution/missing-link"},"expected":{"must_emit":[{"rule_id":"AET-CTX-001","status":"FAIL","evidence_path":"AGENTS.md","remediation_required":true}],"must_not_emit":[]},"dimensions":["remediation_presence"],"tags":["remediation"]},
    {"task_id":"AUD-VAL-012","title":"Package remediation validation","fixture":{"source":"tests/fixtures/audit-evolution/package-script-missing"},"expected":{"must_emit":[{"rule_id":"AET-PKG-001","status":"FAIL","evidence_path":"package.json","remediation_required":true}],"must_not_emit":[]},"dimensions":["remediation_presence"],"tags":["target-improvement"]},
    {"task_id":"AUD-VAL-013","title":"Package status validation","fixture":{"source":"tests/fixtures/audit-evolution/package-script-missing"},"expected":{"must_emit":[{"rule_id":"AET-PKG-001","status":"FAIL","severity":"ERROR","evidence_path":"package.json"}],"must_not_emit":[]},"dimensions":["status_accuracy","severity_accuracy"],"tags":["target-improvement"]},
    {"task_id":"AUD-VAL-014","title":"Candidate runtime validation","fixture":{"source":"tests/fixtures/audit-evolution/package-script-missing"},"expected":{"must_emit":[{"rule_id":"AET-PKG-001","status":"FAIL","evidence_path":"package.json"}],"must_not_emit":[]},"dimensions":["runtime"],"tags":["performance"]},
    {"task_id":"AUD-VAL-015","title":"Candidate determinism validation","fixture":{"source":"tests/fixtures/audit-evolution/package-script-missing"},"expected":{"must_emit":[{"rule_id":"AET-PKG-001","status":"FAIL","evidence_path":"package.json"}],"must_not_emit":[]},"dimensions":["determinism"],"tags":["target-improvement"]}
  ]
}
