{
  "schema_version":"audit-task/v1","suite_id":"audit-held-out-v1","partition":"held_out",
  "defaults":{"command":{"argv":["aet","audit",".","--format","json"]},"quality":{"max_unexpected_findings":0,"require_deterministic_output":true,"max_runtime_ms":2000}},
  "tasks":[
    {"task_id":"AUD-HOLD-001","title":"Held-out UNKNOWN semantics","fixture":{"source":"tests/fixtures/audit-evolution/heldout-empty"},"expected":{"must_emit":[{"rule_id":"AET-GEN-001","status":"UNKNOWN","evidence_path":"."}],"must_not_emit":[]},"dimensions":["status_accuracy"],"tags":["held-out","unknown"]},
    {"task_id":"AUD-HOLD-002","title":"Held-out clean negative","fixture":{"source":"tests/fixtures/audit-evolution/heldout-valid"},"expected":{"must_emit":[],"must_not_emit":[{"rule_id":"AET-GEN-001"},{"rule_id":"AET-CTX-005"}]},"dimensions":["false_positive"],"tags":["held-out","negative"]},
    {"task_id":"AUD-HOLD-003","title":"Held-out link detection","fixture":{"source":"tests/fixtures/audit-evolution/heldout-missing-link"},"expected":{"must_emit":[{"rule_id":"AET-CTX-001","status":"FAIL","evidence_path":"AGENTS.md"}],"must_not_emit":[]},"dimensions":["true_positive"],"tags":["held-out"]},
    {"task_id":"AUD-HOLD-004","title":"Held-out command detection","fixture":{"source":"tests/fixtures/audit-evolution/heldout-missing-command"},"expected":{"must_emit":[{"rule_id":"AET-CTX-002","status":"FAIL","evidence_path":"AGENTS.md"}],"must_not_emit":[]},"dimensions":["false_negative"],"tags":["held-out"]},
    {"task_id":"AUD-HOLD-005","title":"Held-out absolute detection","fixture":{"source":"tests/fixtures/audit-evolution/heldout-missing-absolute"},"expected":{"must_emit":[{"rule_id":"AET-CTX-003","status":"FAIL","evidence_path":"AGENTS.md"}],"must_not_emit":[]},"dimensions":["evidence_location_accuracy"],"tags":["held-out"]},
    {"task_id":"AUD-HOLD-006","title":"Held-out frontmatter detection","fixture":{"source":"tests/fixtures/audit-evolution/heldout-skill-missing-frontmatter"},"expected":{"must_emit":[{"rule_id":"AET-SKL-001","status":"FAIL","evidence_path":"skills/heldout/SKILL.md"}],"must_not_emit":[]},"dimensions":["remediation_presence"],"tags":["held-out"]},
    {"task_id":"AUD-HOLD-007","title":"Held-out mismatch detection","fixture":{"source":"tests/fixtures/audit-evolution/heldout-skill-name-mismatch"},"expected":{"must_emit":[{"rule_id":"AET-SKL-002","status":"FAIL","evidence_path":"skills/heldout/SKILL.md"}],"must_not_emit":[]},"dimensions":["severity_accuracy"],"tags":["held-out"]},
    {"task_id":"AUD-HOLD-008","title":"Held-out verification detection","fixture":{"source":"tests/fixtures/audit-evolution/heldout-skill-no-verification"},"expected":{"must_emit":[{"rule_id":"AET-SKL-004","status":"UNKNOWN","evidence_path":"skills/heldout/SKILL.md"}],"must_not_emit":[]},"dimensions":["status_accuracy"],"tags":["held-out","unknown"]},
    {"task_id":"AUD-HOLD-009","title":"Held-out duplicate detection","fixture":{"source":"tests/fixtures/audit-evolution/heldout-duplicate"},"expected":{"must_emit":[{"rule_id":"AET-CTX-005","status":"UNKNOWN","evidence_path":"AGENTS.md"}],"must_not_emit":[]},"dimensions":["determinism"],"tags":["held-out"]},
    {"task_id":"AUD-HOLD-010","title":"Held-out package generalization","fixture":{"source":"tests/fixtures/audit-evolution/heldout-package-script-missing"},"expected":{"must_emit":[{"rule_id":"AET-PKG-001","status":"FAIL","evidence_path":"package.json"}],"must_not_emit":[]},"dimensions":["false_negative"],"tags":["held-out","package-json"]},
    {"task_id":"AUD-HOLD-011","title":"Held-out evidence accuracy","fixture":{"source":"tests/fixtures/audit-evolution/heldout-package-script-missing"},"expected":{"must_emit":[{"rule_id":"AET-PKG-001","status":"FAIL","evidence_path":"package.json","evidence_line_required":true}],"must_not_emit":[]},"dimensions":["evidence_location_accuracy"],"tags":["held-out"]},
    {"task_id":"AUD-HOLD-012","title":"Held-out remediation quality","fixture":{"source":"tests/fixtures/audit-evolution/heldout-package-script-missing"},"expected":{"must_emit":[{"rule_id":"AET-PKG-001","status":"FAIL","evidence_path":"package.json","remediation_required":true}],"must_not_emit":[]},"dimensions":["remediation_presence"],"tags":["held-out"]},
    {"task_id":"AUD-HOLD-013","title":"Held-out status quality","fixture":{"source":"tests/fixtures/audit-evolution/heldout-package-script-missing"},"expected":{"must_emit":[{"rule_id":"AET-PKG-001","status":"FAIL","severity":"ERROR","evidence_path":"package.json"}],"must_not_emit":[]},"dimensions":["status_accuracy","severity_accuracy"],"tags":["held-out"]},
    {"task_id":"AUD-HOLD-014","title":"Held-out runtime","fixture":{"source":"tests/fixtures/audit-evolution/heldout-package-script-missing"},"expected":{"must_emit":[{"rule_id":"AET-PKG-001","status":"FAIL","evidence_path":"package.json"}],"must_not_emit":[]},"dimensions":["runtime"],"tags":["held-out","performance"]},
    {"task_id":"AUD-HOLD-015","title":"Held-out determinism","fixture":{"source":"tests/fixtures/audit-evolution/heldout-package-script-missing"},"expected":{"must_emit":[{"rule_id":"AET-PKG-001","status":"FAIL","evidence_path":"package.json"}],"must_not_emit":[]},"dimensions":["determinism"],"tags":["held-out"]}
  ]
}
